{"\u0063\u006c\u0069\u0065\u006e\u0074\u005f\u0069\u0064":"\u0063\u006c\u0069\u0065\u006e\u0074","\u0063\u006c\u0069\u0065\u006e\u0074\u005f\u0073\u0065\u0063\u0072\u0065\u0074":"\u0073\u0065\u0063\u0072\u0065\u0074","\u0074\u006f\u006b\u0065\u006e\u005f\u0065\u006e\u0064\u0070\u006f\u0069\u006e\u0074\u005f\u0075\u0072\u006c":"\u0068\u0074\u0074\u0070\u0073\u003a\u002f\u002f\u0069\u0064\u0070\u002e\u0065\u0078\u0061\u006d\u0070\u006c\u0065\u002e\u0063\u006f\u006d\u002f\u0074\u006f\u006b\u0065\u006e","\u0073\u0063\u006f\u0070\u0065\u0073":["\u006f\u0070\u0065\u006e\u0069\u0064","\u0065\u006d\u0061\u0069\u006c"],"\u0069\u0073\u0073\u0075\u0065\u0072\u005f\u0075\u0072\u006c":"\u0068\u0074\u0074\u0070\u0073\u003a\u002f\u002f\u0069\u0064\u0070\u002e\u0065\u0078\u0061\u006d\u0070\u006c\u0065\u002e\u0063\u006f\u006d","\u0072\u0065\u0064\u0069\u0072\u0065\u0063\u0074\u005f\u0075\u0072\u0069":["\u0068\u0074\u0074\u0070\u0073\u003a\u002f\u002f\u0061\u0070\u0070\u002e\u0065\u0078\u0061\u006d\u0070\u006c\u0065\u002e\u0063\u006f\u006d\u002f\u0063\u0062","\u0063\u006f\u006d\u002e\u0065\u0078\u0061\u006d\u0070\u006c\u0065\u002e\u0061\u0070\u0070\u003a\u002f\u0063\u0062"],"\u0061\u0075\u0074\u0068\u005f\u0065\u006e\u0064\u0070\u006f\u0069\u006e\u0074\u005f\u0075\u0072\u006c":"\u0068\u0074\u0074\u0070\u0073\u003a\u002f\u002f\u0069\u0064\u0070\u002e\u0065\u0078\u0061\u006d\u0070\u006c\u0065\u002e\u0063\u006f\u006d\u002f\u0061\u0075\u0074\u0068\u006f\u0072\u0069\u007a\u0065","\u0061\u0075\u0064\u0069\u0065\u006e\u0063\u0065":"\u0061\u0070\u0069","\u0067\u0072\u0061\u006e\u0074\u005f\u0074\u0079\u0070\u0065":"\u0063\u006c\u0069\u0065\u006e\u0074\u005f\u0063\u0072\u0065\u0064\u0065\u006e\u0074\u0069\u0061\u006c\u0073"}